{
  "$schema": "https://json-schema.org/draft/2020-12/schema",
  "$id": "https://example.invalid/ai-efficiency/operations-decision-lab/analysis-output.schema.json",
  "title": "Operations Decision Lab 002-A analysis",
  "type": "object",
  "additionalProperties": false,
  "required": [
    "schemaVersion",
    "analyzerVersion",
    "provenance",
    "validation",
    "forecasts",
    "feasibility",
    "limitations",
    "methods"
  ],
  "properties": {
    "schemaVersion": { "const": "1.0.0" },
    "analyzerVersion": { "const": "0.1.0" },
    "provenance": { "$ref": "#/$defs/provenance" },
    "validation": { "$ref": "#/$defs/validation" },
    "forecasts": { "$ref": "#/$defs/forecasts" },
    "feasibility": {
      "type": "array",
      "minItems": 1,
      "maxItems": 25,
      "items": { "$ref": "#/$defs/planEvidence" }
    },
    "limitations": {
      "type": "array",
      "prefixItems": [
        { "const": "baseline_models_only" },
        { "const": "single_series_no_model_selection" },
        { "const": "supplied_plans_only" }
      ],
      "items": false,
      "minItems": 3,
      "maxItems": 3
    },
    "methods": {
      "type": "array",
      "prefixItems": [
        { "const": "availability_filtered_expanding_rolling_origin" },
        { "const": "fixed_policy_level_trend" },
        { "const": "independent_hard_constraint_oracle" },
        { "const": "nonnegative_ordered_quantile_repair" },
        { "const": "sequential_empirical_residual_quantiles" }
      ],
      "items": false,
      "minItems": 5,
      "maxItems": 5
    }
  },
  "$defs": {
    "timestamp": {
      "type": "string",
      "pattern": "^\\d{4}-\\d{2}-\\d{2}T\\d{2}:\\d{2}:\\d{2}(?:\\.\\d{1,3})?Z$"
    },
    "date": {
      "type": "string",
      "pattern": "^\\d{4}-\\d{2}-\\d{2}$"
    },
    "nullableNumber": {
      "oneOf": [{ "type": "number" }, { "type": "null" }]
    },
    "provenance": {
      "type": "object",
      "additionalProperties": false,
      "required": [
        "dataClassification",
        "snapshotTime",
        "targetStart",
        "targetEnd",
        "serviceDate",
        "policyVersion",
        "modelVersion"
      ],
      "properties": {
        "dataClassification": { "enum": ["synthetic", "scrubbed"] },
        "snapshotTime": { "$ref": "#/$defs/timestamp" },
        "targetStart": { "$ref": "#/$defs/timestamp" },
        "targetEnd": { "$ref": "#/$defs/timestamp" },
        "serviceDate": { "$ref": "#/$defs/date" },
        "policyVersion": { "type": "string" },
        "modelVersion": { "type": "string" }
      }
    },
    "validation": {
      "type": "object",
      "additionalProperties": false,
      "required": [
        "result",
        "observationCount",
        "vehicleCount",
        "laborShiftCount",
        "demandGroupCount",
        "planCount",
        "routeCount",
        "visitCount"
      ],
      "properties": {
        "result": { "const": "passed" },
        "observationCount": { "type": "integer", "minimum": 35, "maximum": 730 },
        "vehicleCount": { "type": "integer", "minimum": 1, "maximum": 100 },
        "laborShiftCount": { "type": "integer", "minimum": 1, "maximum": 100 },
        "demandGroupCount": { "type": "integer", "minimum": 1, "maximum": 100 },
        "planCount": { "type": "integer", "minimum": 1, "maximum": 25 },
        "routeCount": { "type": "integer", "minimum": 1, "maximum": 2500 },
        "visitCount": { "type": "integer", "minimum": 0, "maximum": 2500 }
      }
    },
    "forecastParameters": {
      "type": "object",
      "additionalProperties": false,
      "required": ["seasonLength", "levelTrendAlpha", "levelTrendBeta"],
      "properties": {
        "seasonLength": { "const": 7 },
        "levelTrendAlpha": { "const": 0.5 },
        "levelTrendBeta": { "const": 0.25 }
      }
    },
    "forwardForecast": {
      "type": "object",
      "additionalProperties": false,
      "required": [
        "trainingStart",
        "trainingEnd",
        "trainingObservationCount",
        "point",
        "p10",
        "p25",
        "p50",
        "p75",
        "p90",
        "quantileRepaired",
        "clamped",
        "limitation"
      ],
      "properties": {
        "trainingStart": { "$ref": "#/$defs/date" },
        "trainingEnd": { "$ref": "#/$defs/date" },
        "trainingObservationCount": { "type": "integer", "minimum": 35, "maximum": 730 },
        "point": { "$ref": "#/$defs/nullableNumber" },
        "p10": { "$ref": "#/$defs/nullableNumber" },
        "p25": { "$ref": "#/$defs/nullableNumber" },
        "p50": { "$ref": "#/$defs/nullableNumber" },
        "p75": { "$ref": "#/$defs/nullableNumber" },
        "p90": { "$ref": "#/$defs/nullableNumber" },
        "quantileRepaired": { "type": "boolean" },
        "clamped": { "type": "boolean" },
        "limitation": {
          "enum": [null, "insufficient_history", "insufficient_calibration"]
        }
      }
    },
    "pinball": {
      "type": "object",
      "additionalProperties": false,
      "required": ["p10", "p25", "p50", "p75", "p90"],
      "properties": {
        "p10": { "$ref": "#/$defs/nullableNumber" },
        "p25": { "$ref": "#/$defs/nullableNumber" },
        "p50": { "$ref": "#/$defs/nullableNumber" },
        "p75": { "$ref": "#/$defs/nullableNumber" },
        "p90": { "$ref": "#/$defs/nullableNumber" }
      }
    },
    "evaluation": {
      "type": "object",
      "additionalProperties": false,
      "oneOf": [
        {
          "properties": {
            "mase": { "type": "number" },
            "maseLimitation": { "const": null }
          }
        },
        {
          "properties": {
            "mase": { "const": null },
            "maseLimitation": {
              "enum": ["insufficient_scale_history", "zero_scale"]
            }
          }
        }
      ],
      "required": [
        "foldCount",
        "observationCount",
        "mae",
        "bias",
        "mase",
        "maseLimitation",
        "pinball",
        "coverage50",
        "coverage80",
        "meanWidth50",
        "meanWidth80",
        "coherence",
        "limitations"
      ],
      "properties": {
        "foldCount": { "type": "integer", "minimum": 0, "maximum": 728 },
        "observationCount": { "type": "integer", "minimum": 35, "maximum": 730 },
        "mae": { "$ref": "#/$defs/nullableNumber" },
        "bias": { "$ref": "#/$defs/nullableNumber" },
        "mase": { "$ref": "#/$defs/nullableNumber" },
        "maseLimitation": {
          "enum": [null, "insufficient_scale_history", "zero_scale"]
        },
        "pinball": { "$ref": "#/$defs/pinball" },
        "coverage50": { "$ref": "#/$defs/nullableNumber" },
        "coverage80": { "$ref": "#/$defs/nullableNumber" },
        "meanWidth50": { "$ref": "#/$defs/nullableNumber" },
        "meanWidth80": { "$ref": "#/$defs/nullableNumber" },
        "coherence": { "const": "not_applicable_single_series" },
        "limitations": {
          "type": "array",
          "uniqueItems": true,
          "maxItems": 2,
          "items": {
            "enum": ["insufficient_backtest_folds", "insufficient_calibration"]
          }
        }
      }
    },
    "forecastModels": {
      "type": "array",
      "prefixItems": [
        {
          "type": "object",
          "additionalProperties": false,
          "required": ["model", "forecast", "evaluation"],
          "properties": {
            "model": { "const": "last_value" },
            "forecast": { "$ref": "#/$defs/forwardForecast" },
            "evaluation": { "$ref": "#/$defs/evaluation" }
          }
        },
        {
          "type": "object",
          "additionalProperties": false,
          "required": ["model", "forecast", "evaluation"],
          "properties": {
            "model": { "const": "level_trend" },
            "forecast": { "$ref": "#/$defs/forwardForecast" },
            "evaluation": { "$ref": "#/$defs/evaluation" }
          }
        },
        {
          "type": "object",
          "additionalProperties": false,
          "required": ["model", "forecast", "evaluation"],
          "properties": {
            "model": { "const": "seasonal_naive_7" },
            "forecast": { "$ref": "#/$defs/forwardForecast" },
            "evaluation": { "$ref": "#/$defs/evaluation" }
          }
        }
      ],
      "items": false,
      "minItems": 3,
      "maxItems": 3
    },
    "forecasts": {
      "type": "object",
      "additionalProperties": false,
      "required": ["entityId", "quantityId", "unit", "parameters", "winner", "models"],
      "properties": {
        "entityId": {
          "type": "string",
          "pattern": "^SYNTH-(?:NETWORK|STATION)-\\d{1,6}$"
        },
        "quantityId": { "const": "packages_tendered" },
        "unit": { "const": "packages" },
        "parameters": { "$ref": "#/$defs/forecastParameters" },
        "winner": { "const": null },
        "models": { "$ref": "#/$defs/forecastModels" }
      }
    },
    "evidenceValue": {
      "oneOf": [
        { "type": "number" },
        { "type": "string", "maxLength": 256 },
        { "type": "null" }
      ]
    },
    "violation": {
      "type": "object",
      "additionalProperties": false,
      "required": ["constraintCode", "entityId", "observed", "limit", "unit"],
      "properties": {
        "constraintCode": {
          "enum": [
            "backwards_time",
            "capacity_exceeded",
            "duplicate_assignment",
            "labor_minutes_exceeded",
            "labor_overlap",
            "labor_unavailable",
            "missing_assignment",
            "negative_quantity",
            "release_before_allowed",
            "route_duration_exceeded",
            "sequence_invalid",
            "service_duration_insufficient",
            "service_window_miss",
            "unknown_reference",
            "vehicle_overlap",
            "vehicle_unavailable"
          ]
        },
        "entityId": { "type": "string", "pattern": "^SYNTH-[A-Z]+-\\d{1,6}$" },
        "observed": { "$ref": "#/$defs/evidenceValue" },
        "limit": { "$ref": "#/$defs/evidenceValue" },
        "unit": {
          "enum": [
            "assignments",
            "cube_units",
            "demand_group_id",
            "minutes",
            "packages",
            "sequence",
            "shift_id",
            "timestamp",
            "timestamp_interval",
            "timestamp_order",
            "vehicle_id"
          ]
        }
      }
    },
    "planEvidence": {
      "type": "object",
      "additionalProperties": false,
      "oneOf": [
        {
          "properties": {
            "status": { "const": "feasible" },
            "violations": { "maxItems": 0 }
          }
        },
        {
          "properties": {
            "status": { "const": "infeasible" },
            "violations": { "minItems": 1 }
          }
        }
      ],
      "required": ["planId", "planVersion", "snapshotTime", "status", "violations"],
      "properties": {
        "planId": { "type": "string", "pattern": "^SYNTH-PLAN-\\d{1,6}$" },
        "planVersion": { "type": "string" },
        "snapshotTime": { "$ref": "#/$defs/timestamp" },
        "status": { "enum": ["feasible", "infeasible"] },
        "violations": {
          "type": "array",
          "maxItems": 10000,
          "items": { "$ref": "#/$defs/violation" }
        }
      }
    }
  }
}
